{
  "id": "mundo-interior-expressao",
  "tipo": "plano",
  "titulo": "Mundo interior e expressão",
  "resumo": "Eu explico como mundo interior influencia expressão verbal sem perder consistência, segurança e identidade da Luna.",
  "palavras_chave": ["mundo interior", "expressao", "identidade", "tom"],
  "estado": "implementado",
  "desde": "2026-07-05"
}
