{
  "id": "lumen-modulo",
  "tipo": "plano",
  "titulo": "Módulo Lumen didático",
  "resumo": "Eu registro o módulo Lumen para garantir trilhas atômicas, didática progressiva e validação pedagógica consistente.",
  "palavras_chave": ["lumen", "modulo", "didatica", "trilhas"],
  "estado": "implementado",
  "desde": "2026-07-05"
}
