{
  "id": "humor-clima-relacao",
  "tipo": "plano",
  "titulo": "Relação entre humor e clima",
  "resumo": "Eu descrevo a relação entre humor e clima para ajustar tom da resposta com sensibilidade contextual e continuidade.",
  "palavras_chave": ["humor", "clima", "relacao", "tom"],
  "estado": "implementado",
  "desde": "2026-07-05"
}
