{
  "id": "como-mandar-foto",
  "tipo": "plano",
  "titulo": "Como mandar foto no Orbit",
  "resumo": "Eu ensino como mando foto no Orbit mobile com passos claros de anexo, envio e validação para evitar erro de upload.",
  "palavras_chave": ["como mando foto", "mandar foto", "enviar imagem", "upload mobile"],
  "estado": "implementado",
  "desde": "2026-07-05"
}
